{
    "benefits_status":   {
      "passported": true,
      "client_benefits": ["JSA"],
      "partner_benefits": ["income_support"]
    },
    "total_income": 1234,
    "income": {
      "employment_status": "employed",
      "employed_income": {
        "paye": [
          {
            "paye_date": "2022-02-01",
            "paye_amount": 555,
            "paye_deductions": [
              {
                "paye_deduction_type": "ni contribution", "paye_deduction_amount": 10
              }
            ]
          }
        ]
      }
    },
    "capital": {
       "housing": [
         {
           "property_value": 123456,
           "remaining_mortgage": 1234,
           "ownership_type": "sole"
         }
        ]
    }
}
